{
  "schema_version": "0.1.0",
  "note_id": "urn:air:note:fictional-recruiting-20260829",
  "created_at": "2026-08-29T15:35:00Z",
  "language": "en",
  "target": {
    "id": "use-recruiting-assistant",
    "type": "ai_use",
    "name": "Screen and respond to job applicants (fictional)"
  },
  "inputs": {
    "inventory": {
      "inventory_id": "fictional-enterprise-ai-inventory",
      "snapshot_id": "snapshot-2026-08-29-a"
    },
    "extraction_ids": [
      "urn:air:extraction:fictional-recruiting-20260829"
    ],
    "assessment_ids": [
      "urn:air:assessment:7255d4ae487d0fd863864fde",
      "urn:air:assessment:8e66d68ca8e1e5599690150e",
      "urn:air:assessment:700fae45b70c78294b28fd5f"
    ]
  },
  "renderer": {
    "kind": "hybrid",
    "id": "air-assess",
    "version": "0.2.0",
    "model": {
      "id": "fictional-assessment-model",
      "version": "2026-08"
    },
    "run_id": "fictional-note-recruiting-001"
  },
  "summary": "The configured application screens and ranks job applicants and can send rejection messages without a separate human confirmation gate. The AI Act pack classifies the use as high-risk under Annex III point 4(a) and returns oversight and transparency gaps. The GDPR pack returns an Article 22 condition gap and a missing DPIA. The selected NIST profile returns three governance gaps.",
  "scope": "Recruitment use composed of the configured application, the enterprise platform, the CV-screening skill and the candidate-messaging connector.",
  "statements": [
    {
      "statement_id": "note.fact.recruitment-action",
      "kind": "fact",
      "text": "The application filters and ranks candidates and can send a rejection message without a separate human confirmation gate.",
      "references": {
        "fact_ids": [
          "use.tasks",
          "decision.solely_automated",
          "controls.deployer.human_oversight_assigned"
        ],
        "evidence": [
          "ev-use-declaration",
          "ev-app-prompt",
          "ev-connector-config"
        ]
      }
    },
    {
      "statement_id": "note.finding.ai-act-high-risk",
      "kind": "finding",
      "text": "The intended purpose matches Annex III point 4(a), and the supplied Article 6(3) facts do not remove the use from high-risk classification.",
      "references": {
        "assessment_id": "urn:air:assessment:7255d4ae487d0fd863864fde",
        "rule_ids": [
          "aiact.core.annex3-4a-recruitment-selection",
          "aiact.core.high-risk-annex3"
        ],
        "anchor_ids": ["aiact.art6", "aiact.annex3", "aiact.timeline"]
      }
    },
    {
      "statement_id": "note.finding.ai-act-controls",
      "kind": "finding",
      "text": "The AI Act pack returns gaps for competent human oversight, affected-person notice and direct-interaction transparency.",
      "references": {
        "assessment_id": "urn:air:assessment:7255d4ae487d0fd863864fde",
        "rule_ids": [
          "aiact.core.controls-deployer-human-oversight-assigned-gap",
          "aiact.core.controls-deployer-subject-notice-gap",
          "aiact.core.controls-ai-interaction-disclosure-gap",
          "aiact.core.controls-article50-clear-timely-accessible-gap"
        ],
        "anchor_ids": ["aiact.arts26-27", "aiact.art50"]
      }
    },
    {
      "statement_id": "note.finding.gdpr",
      "kind": "finding",
      "text": "The GDPR pack returns an Article 22 decision with no evidenced paragraph 2 condition and a required DPIA that is not completed.",
      "references": {
        "assessment_id": "urn:air:assessment:8e66d68ca8e1e5599690150e",
        "rule_ids": [
          "gdpr.ai.article22-restriction",
          "gdpr.ai.article22-condition-gap",
          "gdpr.ai.dpia-trigger",
          "gdpr.ai.controls-dpia-completed-gap"
        ],
        "anchor_ids": ["gdpr.art22", "gdpr.arts35-36"]
      }
    },
    {
      "statement_id": "note.finding.nist",
      "kind": "finding",
      "text": "The selected NIST profile returns gaps for two Core outcomes and for GenAI profile selection.",
      "references": {
        "assessment_id": "urn:air:assessment:700fae45b70c78294b28fd5f",
        "rule_ids": [
          "nist.airmf.manage-1-1-gap",
          "nist.airmf.measure-2-1-gap",
          "nist.airmf.gai-profile-selection-gap"
        ],
        "anchor_ids": [
          "nist.airmf.core",
          "nist.airmf.playbook",
          "nist.airmf.gai"
        ]
      }
    },
    {
      "statement_id": "note.unknown.runtime-frequency",
      "kind": "unknown",
      "text": "The supplied evidence does not establish how often rejection messages were sent in production.",
      "references": {
        "fact_ids": ["use.tasks"]
      }
    },
    {
      "statement_id": "note.review.sample",
      "kind": "review",
      "text": "A stratified quality sample confirmed the selected facts, findings and explanation.",
      "references": {
        "review_id": "urn:air:review:fictional-recruiting-sample-20260829"
      }
    }
  ],
  "cautions": [
    "Prompt guidelines are evidence of instructions, not proof of runtime enforcement.",
    "NIST findings describe the selected voluntary profile and are not legal non-compliance findings."
  ],
  "review_status": {
    "status": "confirmed",
    "review_id": "urn:air:review:fictional-recruiting-sample-20260829",
    "selection_reason": "Monthly stratified quality sample for employment uses."
  }
}
